course_title,level,num_subscribers,platform,price,num_reviews,subject,course_rating,course_organization,category,engagement_score,rating,num_subscribers_scaled,price_scaled,num_reviews_scaled
Ultimate Investment Banking Course,All Levels,2147,Udemy,200.0,23.0,Business Finance,,,Business Finance,0.36963030038132844,1.0189348673814616,0.0008588,1.0,0.0008380397157952268
Complete GST Course & Certification - Grow Your CA Practice,All Levels,2792,Udemy,75.0,923.0,Business Finance,,,Business Finance,2.4331400495762554,1.124641254008992,0.0011168,0.375,0.03363089815995628
Financial Modeling for Business Analysts and Consultants,Intermediate Level,2174,Udemy,45.0,74.0,Business Finance,,,Business Finance,0.48514203854685917,1.0248521296862834,0.0008696,0.225,0.002696301694297686
Beginner to Pro - Financial Analysis in Excel 2017,All Levels,2451,Udemy,95.0,11.0,Business Finance,,,Business Finance,0.3886134178643876,1.0199073060902406,0.0009804,0.47500000000000003,0.00040080160320641277
How To Maximize Your Profits Trading Options,Intermediate Level,1276,Udemy,200.0,45.0,Business Finance,,,Business Finance,0.28817267996466406,1.014762078413112,0.0005103999999999999,1.0,0.0016396429222080523
Trading Penny Stocks: A Guide for All Levels In 2017,All Levels,9221,Udemy,150.0,138.0,Business Finance,,,Business Finance,1.6732393124302791,1.085714197255014,0.0036883999999999997,0.75,0.00502823829477136
Investing And Trading For Beginners: Mastering Price Charts,Beginner Level,1540,Udemy,65.0,178.0,Business Finance,,,Business Finance,0.6182037706221938,1.0316684167920613,0.000616,0.325,0.006485698670067407
"Trading Stock Chart Patterns For Immediate, Explosive Gains",All Levels,2917,Udemy,95.0,148.0,Business Finance,,,Business Finance,0.7574350459584119,1.0388007480190287,0.0011668,0.47500000000000003,0.005392603388595372
Options Trading 3 : Advanced Stock Profit and Success Method,Expert Level,5172,Udemy,195.0,34.0,Business Finance,,,Business Finance,0.8436213170379353,1.0432157692207804,0.0020688,0.975,0.0012388413190016396
The Only Investment Strategy You Need For Your Retirement,All Levels,827,Udemy,200.0,14.0,Business Finance,,,Business Finance,0.15361585638498942,1.0078692029991554,0.00033079999999999996,1.0,0.0005101111313536163
Forex Trading Secrets of the Pros With Amazon's AWS,All Levels,4284,Udemy,200.0,93.0,Business Finance,,,Business Finance,0.8405241426079233,1.0430571118081466,0.0017136,1.0,0.0033885953725633082
Trading Options With Money Flow,All Levels,1380,Udemy,200.0,42.0,Business Finance,,,Business Finance,0.2970832202521225,1.015218534224408,0.000552,1.0,0.0015303333940608489
Financial Management Risk and Return For Securities,All Levels,3607,Udemy,30.0,21.0,Business Finance,,,Business Finance,0.5824204527687509,1.0298353625826941,0.0014428,0.15,0.0007651666970304244
Forex Trading Course: Work Smarter Not Harder Proven Results,All Levels,4061,Udemy,195.0,52.0,Business Finance,,,Business Finance,0.7177209836549779,1.0367663355205974,0.0016244,0.975,0.0018946984878848605
Python Algo Trading: Sentiment Trading with News,All Levels,294,Udemy,200.0,19.0,Business Finance,,,Business Finance,0.0852676103212204,1.004367961424431,0.0001176,1.0,0.0006922936782656221
Short Selling: Learn To Sell Stocks Before The Fall,Intermediate Level,2276,Udemy,75.0,106.0,Business Finance,,,Business Finance,0.570271765614739,1.029213027833939,0.0009104,0.375,0.003862269994534523
Basic Technical Analysis: Learn the structure of the market,Beginner Level,4919,Udemy,20.0,79.0,Business Finance,,,Business Finance,0.9043683026588654,1.0463276248109992,0.0019676,0.1,0.0028784842412096917
The Complete Chart Pattern Trading Course: A Proven Approach,All Levels,2666,Udemy,200.0,115.0,Business Finance,,,Business Finance,0.6479566505923254,1.0331925527621637,0.0010664,1.0,0.0041901985789761335
7 Deadly Mistakes of Investing that Will Slash Your Profits!,All Levels,5354,Udemy,50.0,24.0,Business Finance,,,Business Finance,0.8488303573670033,1.0434826101364572,0.0021416,0.25,0.000874476225177628
Financial Statements Made Easy,Beginner Level,8095,Udemy,95.0,249.0,Business Finance,,,Business Finance,1.7484235794814629,1.0895656242736267,0.003238,0.47500000000000003,0.00907269083621789
Winning Forex Trading with Live Forex Trading Examples,All Levels,809,Udemy,200.0,3.0,Business Finance,,,Business Finance,0.12689041388901592,1.0065001520613668,0.0003236,1.0,0.0001093095281472035
Forex Traders - Create Your First Trading Robot. No Coding!,All Levels,2295,Udemy,200.0,84.0,Business Finance,,,Business Finance,0.5250016609948687,1.0268939987217753,0.000918,1.0,0.0030606667881216978
Create A Business From Home Trading Stocks Today In 2017,All Levels,10149,Udemy,75.0,83.0,Business Finance,,,Business Finance,1.6910309075644872,1.086625598441614,0.0040596,0.375,0.0030242302787392965
Introduction to Accounting : Mastering Financial Statements,Beginner Level,1916,Udemy,50.0,38.0,Business Finance,,,Business Finance,0.36806388126276707,1.0188546252090986,0.0007664,0.25,0.0013845873565312443
The Complete Ethereum Course: Get .01 Ether In Your Wallet,All Levels,2507,Udemy,45.0,333.0,Business Finance,,,Business Finance,1.1008963009657653,1.0563950667410742,0.0010027999999999999,0.225,0.012133357624339588
Beginner to Pro in PowerPoint: Complete PowerPoint Training,All Levels,5786,Udemy,150.0,518.0,Business Finance,,,Business Finance,1.993064806747504,1.1020977386309767,0.0023144,0.75,0.018874111860083802
Investing 101: The Complete Online Investing Course,All Levels,5334,Udemy,200.0,373.0,Business Finance,,,Business Finance,1.6088360346082737,1.0824150426044536,0.0021336,1.0,0.013590817999635635
Create Your Own Hedge Fund: Trade Stocks Like A Fund Manager,Intermediate Level,4005,Udemy,175.0,237.0,Business Finance,,,Business Finance,1.1138367159662437,1.0570579589380678,0.001602,0.875,0.008635452723629075
Learn MQL5: Build an 8-Currency Hedging Robot (MetaTrader 5),All Levels,2877,Udemy,150.0,103.0,Business Finance,,,Business Finance,0.6531068121735092,1.0334563775255348,0.0011508,0.75,0.00375296046638732
Forex Trading: Your Complete Guide to Get Started Like a Pro,Beginner Level,1026,Udemy,140.0,25.0,Business Finance,,,Business Finance,0.2072635033781611,1.0106173843038135,0.0004104,0.7000000000000001,0.0009109127345600291
Python Algo Stock Trading: Automate Your Trading!,Beginner Level,1165,Udemy,95.0,21.0,Business Finance,,,Business Finance,0.2191938042485424,1.0112285318871381,0.000466,0.47500000000000003,0.0007651666970304244
THE Forex Robot: Incredible ROI (Robot Included),All Levels,1843,Udemy,200.0,171.0,Business Finance,,,Business Finance,0.6479690994586629,1.0331931904740421,0.0007371999999999999,1.0,0.006230643104390599
The Complete Bitcoin Course: Get .001 Bitcoin In Your Wallet,All Levels,8797,Udemy,45.0,449.0,Business Finance,,,Business Finance,2.2900781979102383,1.1173126957553863,0.0035188,0.225,0.016359992712698123
Mastering High Probability Iron Condor Options Trading,All Levels,1030,Udemy,200.0,11.0,Business Finance,,,Business Finance,0.17725180134218602,1.0090799897845957,0.000412,1.0,0.00040080160320641277
The Complete Short Course on Ethereum,All Levels,1041,Udemy,200.0,12.0,Business Finance,,,Business Finance,0.18107414797954546,1.0092757952328766,0.0004164,1.0,0.000437238112588814
Options Trading Stocks: Proven Toolbox For Financial Success,Intermediate Level,7884,Udemy,195.0,118.0,Business Finance,,,Business Finance,1.430648167399277,1.0732871014397085,0.0031536,0.975,0.004299508107123338
Forex Trading A-Z™ - With LIVE Examples of Forex Trading,Beginner Level,16900,Udemy,195.0,2476.0,Business Finance,,,Business Finance,7.926738529996742,1.4060590884409854,0.0067599999999999995,0.975,0.09021679723082528
"Introduction to Finance, Accounting, Modeling and Valuation",All Levels,11441,Udemy,200.0,1118.0,Business Finance,,,Business Finance,4.145912108224747,1.2123805755736057,0.0045763999999999996,1.0,0.0407360174895245
Beginner to Pro in Excel: Financial Modeling and Valuation,All Levels,22257,Udemy,195.0,2697.0,Business Finance,,,Business Finance,9.206694652647657,1.4716267635246623,0.008902799999999999,0.975,0.09826926580433594
The Complete Investment Banking Course 2017,All Levels,8575,Udemy,195.0,809.0,Business Finance,,,Business Finance,3.0440861961591756,1.1559378881075177,0.00343,0.975,0.02947713609036254
The Complete Financial Analyst Course 2017,All Levels,24481,Udemy,195.0,2347.0,Business Finance,,,Business Finance,8.772328965571754,1.4493757287167617,0.0097924,0.975,0.08551648752049552
Python for Finance: Investment Fundamentals & Data Analytics,All Levels,3811,Udemy,195.0,278.0,Business Finance,,,Business Finance,1.174614685552716,1.0601714017284642,0.0015244,0.975,0.010129349608307523
Financial Modeling for Startups & Small Businesses,Beginner Level,4991,Udemy,195.0,137.0,Business Finance,,,Business Finance,1.0418767405239764,1.0533717011005288,0.0019963999999999997,0.975,0.004991801785388959
Options Trading - How to Win with Weekly Options,Intermediate Level,7489,Udemy,115.0,1190.0,Business Finance,,,Business Finance,3.7154915736576775,1.1903316371292265,0.0029955999999999997,0.5750000000000001,0.04335944616505738
Black Algo Trading: Build Your Trading Robot,All Levels,20195,Udemy,200.0,1113.0,Business Finance,,,Business Finance,5.437063907722028,1.278521766021453,0.008078,1.0,0.04055383494261249
Accounting & Financial Statement Analysis: Complete Training,All Levels,10042,Udemy,150.0,594.0,Business Finance,,,Business Finance,2.7922589488686844,1.143037659079852,0.0040168,0.75,0.021643286573146292
Cryptocurrency Trading: Complete Guide To Trading Altcoins,All Levels,367,Udemy,95.0,42.0,Business Finance,,,Business Finance,0.1464081199445995,1.0074999758728118,0.0001468,0.47500000000000003,0.0015303333940608489
Forex Robots: Expect To Earn 175% P.A. Forex Robot Included!,All Levels,10603,Udemy,200.0,872.0,Business Finance,,,Business Finance,3.483463885162319,1.1784456702429777,0.0042412,1.0,0.03177263618145382
Three Steps Trading - Live Trading - Real Account,All Levels,1197,Udemy,190.0,11.0,Business Finance,,,Business Finance,0.20209162538103725,1.0103524470844145,0.0004788,0.9500000000000001,0.00040080160320641277
Option Trading for Rookies:  Understand Options Completely,All Levels,2893,Udemy,150.0,65.0,Business Finance,,,Business Finance,0.5724114341626024,1.0293226355694312,0.0011572,0.75,0.0023683731098560756
How I Learned Stock Trading (and How You Can Too),Expert Level,1580,Udemy,200.0,12.0,Business Finance,,,Business Finance,0.2612457956258977,1.013382708314328,0.000632,1.0,0.000437238112588814
Learn to Trade for Profit: Find and Trade Winning Stocks,All Levels,10605,Udemy,95.0,71.0,Business Finance,,,Business Finance,1.73262272716674,1.088756201878372,0.004242,0.47500000000000003,0.0025869921661504825
Trading Inside Bars - Master 1 Easy Pattern To Be Successful,Intermediate Level,2996,Udemy,125.0,200.0,Business Finance,,,Business Finance,0.8828675306750321,1.0452262154684941,0.0011983999999999999,0.625,0.0072873018764802325
Four Fundamentals of Financial Planning,All Levels,6219,Udemy,30.0,23.0,Business Finance,,,Business Finance,0.97530553083763,1.0499614908836337,0.0024876,0.15,0.0008380397157952268
Options Trading - Calendar Spread Course for Every Trader,All Levels,1113,Udemy,200.0,11.0,Business Finance,,,Business Finance,0.1895973426309564,1.0097124086821103,0.0004452,1.0,0.00040080160320641277
Dividend Investing: Build Your Portfolio for a Better Future,Beginner Level,8314,Udemy,60.0,83.0,Business Finance,,,Business Finance,1.4180903260597437,1.0726438071531843,0.0033255999999999997,0.3,0.0030242302787392965
Learn Accounting. Understand Business.,Beginner Level,5572,Udemy,200.0,123.0,Business Finance,,,Business Finance,1.097688861664152,1.0562307608447572,0.0022288,1.0,0.004481690654035343
How to Consistently Win Trading Stocks in 30 Days or Less,Intermediate Level,1433,Udemy,145.0,169.0,Business Finance,,,Business Finance,0.5826127191954752,1.0298452117192183,0.0005732,0.725,0.006157770085625796
A Beginner's Guide to Quantopian Futures API,Intermediate Level,936,Udemy,20.0,6.0,Business Finance,,,Business Finance,0.1523391511642799,1.0078038018564068,0.0003744,0.1,0.000218619056294407
How to Buy Cheap Options - Options Trading Pricing Model,All Levels,658,Udemy,200.0,2.0,Business Finance,,,Business Finance,0.10224426266818837,1.0052376159425789,0.0002632,1.0,7.287301876480233e-05
Excel Crash Course: Master Excel for Financial Analysis,All Levels,8121,Udemy,105.0,689.0,Business Finance,,,Business Finance,2.7142147051709262,1.1390397254613718,0.0032484,0.525,0.0251047549644744
"Comprehensive Guide to Financial Markets, Investing &Trading",Beginner Level,4187,Udemy,60.0,600.0,Business Finance,,,Business Finance,1.9344948362734495,1.0990974039118853,0.0016748,0.3,0.0218619056294407
Stock Trading Ninja: Complete System For Trading Success,All Levels,9445,Udemy,155.0,497.0,Business Finance,,,Business Finance,2.491399811860749,1.1276256978475905,0.0037779999999999997,0.775,0.018108945163053378
Hedge and Mutual Fund Careers: The Complete Guide,All Levels,3255,Udemy,200.0,340.0,Business Finance,,,Business Finance,1.2274582479666178,1.0628783925926846,0.001302,1.0,0.012388413190016396
Algorithmic Trading In Forex: Create Your First Forex Robot!,All Levels,7941,Udemy,185.0,713.0,Business Finance,,,Business Finance,2.7399098156456962,1.140355996093649,0.0031764,0.925,0.02597923118965203
The Power Modeling Bootcamp: Advanced Excel in 10 Days,All Levels,1680,Udemy,150.0,158.0,Business Finance,,,Business Finance,0.5953037639467806,1.0304953295506036,0.000672,0.75,0.005756968482419383
Options Trading Basics (3-Course Bundle),Beginner Level,10100,Udemy,180.0,985.0,Business Finance,,,Business Finance,3.655686463735824,1.1872680305365426,0.00404,0.9,0.035889961741665144
How to Win 97% of Your Options Trades,All Levels,5050,Udemy,125.0,461.0,Business Finance,,,Business Finance,1.7589782291351739,1.0901063020569268,0.00202,0.625,0.016797230825286936
How I Make Consistent Returns Trading Options,All Levels,2310,Udemy,200.0,162.0,Business Finance,,,Business Finance,0.6977556468241636,1.0357435811502775,0.0009239999999999999,1.0,0.005902714519948988
"Forex Strategies: Kelly Criterion, Larry Williams and more!",All Levels,5528,Udemy,185.0,506.0,Business Finance,,,Business Finance,1.9284552229740695,1.0987880156481495,0.0022112,0.925,0.01843687374749499
"Elite Trend Trader: Learn To Trade Stocks, Options & Forex",All Levels,6451,Udemy,125.0,237.0,Business Finance,,,Business Finance,1.4776583303316941,1.0756952676527811,0.0025804,0.625,0.008635452723629075
Options Trading Introduction: Day Trade Stock Options,Beginner Level,12394,Udemy,95.0,218.0,Business Finance,,,Business Finance,2.3200912142039787,1.1188501575994325,0.0049575999999999995,0.47500000000000003,0.007943159045363454
The Almost Perfect Options Trading Strategy System - Unique,All Levels,1793,Udemy,200.0,18.0,Business Finance,,,Business Finance,0.30604487026269583,1.0156776082080459,0.0007172,1.0,0.0006558571688832209
Forex Trading -  Learn to Trade Forex Like the Banks,All Levels,3223,Udemy,20.0,240.0,Business Finance,,,Business Finance,1.0040794649102753,1.0514354788796025,0.0012892,0.1,0.008744762251776278
Learn to Trade for Profit:Trading with Japanese Candlesticks,Beginner Level,16385,Udemy,60.0,273.0,Business Finance,,,Business Finance,3.033958867256055,1.1554191004715713,0.006554,0.3,0.009947167061395517
The Most Powerful Options Spread Trading Front Ratio Spread,All Levels,1487,Udemy,200.0,16.0,Business Finance,,,Business Finance,0.2561576019757988,1.013122057951313,0.0005947999999999999,1.0,0.0005829841501184186
What Finance Job is for You? Explanation of 14 Finance Roles,All Levels,2951,Udemy,200.0,232.0,Business Finance,,,Business Finance,0.9461322629302703,1.0484670464121175,0.0011803999999999999,1.0,0.00845327017671707
The Blueprint for Successful Stock Trading,All Levels,2697,Udemy,120.0,331.0,Business Finance,,,Business Finance,1.1247847974888696,1.0576187908598516,0.0010788,0.6,0.012060484605574785
Trading for Beginners - Intermediate Level,Beginner Level,3979,Udemy,150.0,40.0,Business Finance,,,Business Finance,0.6792898970721892,1.0347976453806933,0.0015915999999999999,0.75,0.0014574603752960465
Start Trading Stocks Using Technical Analysis!,All Levels,3190,Udemy,25.0,244.0,Business Finance,,,Business Finance,1.0079157589388055,1.0516319988039473,0.001276,0.125,0.008890508289305883
Learn How to Set Up an Incubator Hedge Fund - Step-by-Step,Expert Level,1406,Udemy,200.0,71.0,Business Finance,,,Business Finance,0.36435002457157317,1.0186643773212796,0.0005624,1.0,0.0025869921661504825
VPS for Forex Trading - Protect Your Forex Robots,All Levels,4252,Udemy,160.0,225.0,Business Finance,,,Business Finance,1.1243415701546051,1.0575960858738547,0.0017008,0.8,0.008198214611040262
Introduction to Accounting: The Language of Business,Beginner Level,11958,Udemy,20.0,370.0,Business Finance,,,Business Finance,2.587540902640105,1.1325506696422138,0.0047832,0.1,0.01348150847148843
Basic Excel for Basic Bookkeeping and Accounting,Beginner Level,7743,Udemy,95.0,340.0,Business Finance,,,Business Finance,1.895009926328082,1.09707473008722,0.0030972,0.47500000000000003,0.012388413190016396
"Using 'The Greeks To Understand Options""",All Levels,2134,Udemy,50.0,55.0,Business Finance,,,Business Finance,0.43765475939850235,1.0224195224783437,0.0008535999999999999,0.25,0.002004008016032064
Trading Options For Consistent Returns: Calendar Spreads,All Levels,1214,Udemy,200.0,69.0,Business Finance,,,Business Finance,0.33141928287407163,1.0169774506105307,0.0004856,1.0,0.00251411914738568
How to Create Your Personal Budget,All Levels,3870,Udemy,20.0,53.0,Business Finance,,,Business Finance,0.691497555107619,1.0354230010014327,0.001548,0.1,0.0019311349972672615
The Complete Value Investing Course: A Proven Approach,All Levels,2146,Udemy,200.0,212.0,Business Finance,,,Business Finance,0.7826715753164472,1.0400935271447382,0.0008583999999999999,1.0,0.007724539989069046
FOREX Trading with Price Action,Beginner Level,484,Udemy,195.0,57.0,Business Finance,,,Business Finance,0.19660372936208753,1.0100713213671373,0.0001936,0.975,0.0020768810347968664
Emini ES Futures - Advanced Non Directional Options Trading,All Levels,1057,Udemy,200.0,15.0,Business Finance,,,Business Finance,0.19001258304934546,1.0097336799963006,0.0004228,1.0,0.0005465476407360174
Forex Trading - Advanced Fundamental Analysis,Intermediate Level,1754,Udemy,20.0,100.0,Business Finance,,,Business Finance,0.4795115794330006,1.0245637009603168,0.0007015999999999999,0.1,0.0036436509382401163
How To Invest With Tiny Capital In Stocks ?,Beginner Level,1239,Udemy,20.0,5.0,Business Finance,,,Business Finance,0.1952216233784133,1.0100005209119771,0.0004956,0.1,0.0001821825469120058
Learn How To Successfully Trade Stocks: In 5 Simple Steps,All Levels,2493,Udemy,95.0,276.0,Business Finance,,,Business Finance,0.9742010584196066,1.0499049126249242,0.0009972,0.47500000000000003,0.01005647658954272
Forex MetaTrader 4: Master MT4 Like A Pro Forex Trader,Beginner Level,2602,Udemy,150.0,402.0,Business Finance,,,Business Finance,1.2658738886334022,1.0648462914923391,0.0010408,0.75,0.014647476771725268
Intermediate Options trading concepts for Stocks and Options,All Levels,2000,Udemy,40.0,30.0,Business Finance,,,Business Finance,0.3630686395092954,1.018598736446617,0.0007999999999999999,0.2,0.0010930952814720348
Options Trading 101: The Basics,Beginner Level,1514,Udemy,0.0,66.0,Business Finance,,,Business Finance,0.36948314957838535,1.0189273293605365,0.0006056,0.0,0.002404809619238477
Practical Accounts APP Overview,Intermediate Level,1361,Udemy,20.0,1.0,Business Finance,,,Business Finance,0.20462331940651637,1.0104821369138832,0.0005444,0.1,3.643650938240116e-05
Bitcoin Profits for Beginners,Beginner Level,61,Udemy,100.0,18.0,Business Finance,,,Business Finance,0.04842465927293295,1.0024806259129175,2.44e-05,0.5,0.0006558571688832209
Trend Traders Club: How To Find And Trade Fast Moving Trends,All Levels,1513,Udemy,75.0,31.0,Business Finance,,,Business Finance,0.2928177384140325,1.015000028509809,0.0006052,0.375,0.001129531790854436
Financial Statements Basics,Beginner Level,1374,Udemy,20.0,19.0,Business Finance,,,Business Finance,0.24590838853654598,1.0125970265969126,0.0005496,0.1,0.0006922936782656221
High performance Stock Trading using key Options techniques,All Levels,2103,Udemy,40.0,15.0,Business Finance,,,Business Finance,0.3455961515801144,1.0177036820059449,0.0008412,0.2,0.0005465476407360174
Introduction to Financial Statement Analysis,Beginner Level,1480,Udemy,20.0,25.0,Business Finance,,,Business Finance,0.274792126813122,1.0140766394781715,0.000592,0.1,0.0009109127345600291
Basics of Economics (College Level),All Levels,2516,Udemy,25.0,12.0,Business Finance,,,Business Finance,0.40046780341251326,1.0205145647971456,0.0010064,0.125,0.000437238112588814
Stock Market Investing for Beginners,Beginner Level,50855,Udemy,0.0,2698.0,Business Finance,,,Business Finance,13.462589153767901,1.6896413523856624,0.020342,0.0,0.09830570231371834
Accounting for Beginners : Learn Basics in under 1 Hour,Beginner Level,1971,Udemy,50.0,13.0,Business Finance,,,Business Finance,0.32158989756124207,1.0164739255825563,0.0007884,0.25,0.00047367462197121514
Straddle Options Trading - Profit in Any Market Direction,All Levels,837,Udemy,200.0,9.0,Business Finance,,,Business Finance,0.14417231818337398,1.0073854435690575,0.0003348,1.0,0.00032792858444161046
Fundamentals of Forex Trading,All Levels,17160,Udemy,0.0,620.0,Business Finance,,,Business Finance,3.9078416251132744,1.2001850574558925,0.0068639999999999994,0.0,0.02259063581708872
"Binary Options: Trading Strategies, 90% Accuracy and Signals",Beginner Level,1723,Udemy,195.0,38.0,Business Finance,,,Business Finance,0.33935677922984314,1.017384060784757,0.0006892,0.975,0.0013845873565312443
Website Investing 101 - Buying & Selling Online Businesses,All Levels,6811,Udemy,0.0,151.0,Business Finance,,,Business Finance,1.3431928679902791,1.0688070723554937,0.0027244,0.0,0.005501912916742575
Practical Accounts & Bookkeeping Automated Overview ,All Levels,2060,Udemy,20.0,17.0,Business Finance,,,Business Finance,0.3435726498696517,1.0176000250912,0.000824,0.1,0.0006194206595008198
Live Account - ETF Trading System - Hacking The Stock Market,All Levels,2318,Udemy,150.0,19.0,Business Finance,,,Business Finance,0.38632032801364535,1.0197898391180449,0.0009272,0.75,0.0006922936782656221
Stock Market Leverage: How to Start Trading Options Wisely,Beginner Level,2153,Udemy,95.0,14.0,Business Finance,,,Business Finance,0.35084703408269474,1.0179726663498134,0.0008612,0.47500000000000003,0.0005101111313536163
Stock Market Foundations,Beginner Level,19339,Udemy,0.0,794.0,Business Finance,,,Business Finance,4.612346427261093,1.2362743742259459,0.0077356,0.0,0.028930588449626524
Crash Course on Working Capital Management,All Levels,3177,Udemy,20.0,8.0,Business Finance,,,Business Finance,0.49004114708696866,1.025103093880503,0.0012707999999999999,0.1,0.0002914920750592093
Advanced Accounting A Complete Study for CA / CMA / CFA / CS,All Levels,1535,Udemy,150.0,16.0,Business Finance,,,Business Finance,0.2632971921187021,1.0134877941812008,0.000614,0.75,0.0005829841501184186
61% Profit In 1 Month - Crush Your Forex Trading Paradigm,All Levels,1027,Udemy,20.0,29.0,Business Finance,,,Business Finance,0.21615700709124783,1.0110729673909957,0.00041079999999999996,0.1,0.0010566587720896338
How to create a routine Trading,All Levels,307,Udemy,25.0,8.0,Business Finance,,,Business Finance,0.06315315312587197,1.0032351151351118,0.0001228,0.125,0.0002914920750592093
"Forex Trading Secrets |MT4 Robot (EA) inside, no coding",All Levels,2096,Udemy,150.0,48.0,Business Finance,,,Business Finance,0.41669924992809537,1.0213460450271612,0.0008384,0.75,0.001748952450355256
Forex SOS Course: Trading Tweaks And Working Forex Strategy,Beginner Level,1315,Udemy,50.0,48.0,Business Finance,,,Business Finance,0.3005321686446053,1.0153952117866907,0.000526,0.25,0.001748952450355256
Introduction to Financial Modeling,Intermediate Level,29167,Udemy,0.0,1463.0,Business Finance,,,Business Finance,7.536738995630138,1.3860807764507477,0.0116668,0.0,0.0533066132264529
Quantitative Aptitude for Banking & Competitive Examinations,All Levels,1056,Udemy,50.0,1.0,Business Finance,,,Business Finance,0.15925717370681797,1.008158187953136,0.00042239999999999997,0.25,3.643650938240116e-05
Option Spreads and Credit Spreads Bundle,Expert Level,2212,Udemy,180.0,194.0,Business Finance,,,Business Finance,0.7531370816299461,1.0385805783400661,0.0008847999999999999,0.9,0.007068682820185825
B Com Accountancy I (Paper ECO 02 IGNOU),All Levels,2946,Udemy,50.0,6.0,Business Finance,,,Business Finance,0.45130948839835805,1.0231190064829703,0.0011784,0.25,0.000218619056294407
FOREX TRADING - Learn in a quick + profitable way + support,All Levels,271,Udemy,100.0,48.0,Business Finance,,,Business Finance,0.14524608303645722,1.0074404487866249,0.00010839999999999999,0.5,0.001748952450355256
Auditing Basics (Professional Course Level),All Levels,3771,Udemy,25.0,10.0,Business Finance,,,Business Finance,0.5827659562312859,1.0298530615165646,0.0015084,0.125,0.0003643650938240116
Stock market Investing Encyclopedia: How to invest in stocks,Intermediate Level,3143,Udemy,200.0,11.0,Business Finance,,,Business Finance,0.49154250909124425,1.0251800034044605,0.0012572,1.0,0.00040080160320641277
Learn the basics of preparing accounting statements,Intermediate Level,1951,Udemy,20.0,30.0,Business Finance,,,Business Finance,0.3557803079050815,1.0182253807119395,0.0007804,0.1,0.0010930952814720348
